title,pc_sub
Why isn’t selling games that you are finished with something you can do? It’s like we don’t even own the games that we buy.,1
Death of a Game: Gotham City Impostors,1
"Mordhau Dev Won't Police Their Fanbase, Suggests Offended Players Use the Mute Function",1
G2A offered 10 outlets the chance to publish pre-written advertorials without disclosure,1
The First 15 Minutes of Sea of Solitude Gameplay,1
Revisiting Heavy Rain: Quantic Dream's PC debut tested | eurogamer,1
Halo Reach’s Forge and Theater modes won’t be on PC at launch,1
HITMAN 2 - The Golden Handshake: Full Mission Briefing,1
RuneScape gets dinosaurs in a prehistoric update,1
Someday You’ll Return Gameplay Trailer,1
Bloodborne combat mod released for Sekiro: Shadows Die Twice,1
Cemu 1.15.9 - AMD Edition (x r/cemu),1
Riot Games teams up with Nielsen to measure brand exposure for esports sponsors,1
River City Girls - Teaser Trailer,1
Post Scriptum - Tea Time with the Devs Livestream - July 10 - 3pm (Eastern),1
"Valve Index makes VR prettier, but it's the controllers that steal the show",1
Either I had a cheater on my team or he was a smurf of the best Apex player ever.,1
"Halo: Reach PC test 'illegally distributed online', 343 prepared to ban players",1
I have some stuff to ask before I decide on a refund for Shenmue 3,1
"COD Modern Warfare All Perks, Gun Perks, and Multiplayer Details Leaked - Rumor",1
Draugen (PC) review - 2.5/5,1
My friend spent years making the most complicated control scheme ever,1
Announcing Mod Support for Total War: THREE KINGDOMS!,1
"Videogames, Media, and Crossectionality",1
"The Best, Worst And Weirdest Guest Skaters From The Tony Hawk Games",1
Security companies identify security breaches in EA Origin app.,1
Windows 10 at 70% usage on Steam,1
Anyone know the timeframe of when GOG 2.0 launcher will release to the general public?,1
"What is your favorite ""Underrated"" game?",1
The Beauty of The Sinking City,1
Cyberpunk 2077 - Night City News #1,1
BIONICLE The Legend of Mata Nui REBUILT - Announcement Trailer,1
Kindred Teaser Tralier (OPEN WORLD POKEMON Inspired game),1
Does anyone else find it extremely difficult to buy games these days because of the pricing structures?,1
Metal Wolf Chaos XD release news is coming this week,1
ID@Xbox Game Pass direct - Showcase of upcoming indie games coming Xbox Gamepass (PC and Xbox),1
Radeon - Software Adrenalin 2019 Edition 19.6.3 Release Notes,1
Get To The Orange Door Review (Early Access) - GmanLives,1
COD: WW2’s director implies Modern Warfare is controversial “for the sake of headlines”,1
Overcooked is now FREE in the Epic Games Store until July 11th!,1
My Spaceship MMO Wishlist,1
Does lowering your resolution effect your gameplay?,1
"EA: ""I struggle with the perception that we're just a bunch of bad guys""",1
Is anyone still playing Citizens: Giants Kabuto?,1
A very informative insight by Mortiel,1
RuneScape's Land Out of Time - Launch trailer,1
The Alliance Alive HD Remastered - Comparison Trailer - 3DS vs HD,1
Partial Control Trailer - Basically it's a crazy cyborg fight simulation in which you have to predict what's going to happen to win.,1
[Digital Foundry] Heavy Rain on PC: A True Upgrade Over PlayStation 4?,1
Fans Request to add Keanu Reeves in S.T.A.L.K.E.R. 2,1
"Dual Universe, Dev Diary - Alpha 2 coming 11th July, adds Industry gameplay and Graphics improvements",1
"Rumor: New Open-World Tron Game In Development, Coming in 2021",1
Pigeon Simulator - Official Announcement Trailer,1
"Google Stadia, it looks like you are expected to pay for the games on top of subscription",1
Halo MCC Flight One has begun,1
How good is Vampyr?,1
DISSIDIA FINAL FANTASY Tifa Reveal,1
Recommended websites for exclusively PC content?,1
Bandai Namco's Online Action RPG 『BLUE PROTOCOL（ブループロトコル）』PV,1
Having fun with the Borderlands 2 universe... But jeez are these missions long.,1
Jedi: Fallen Order's lightsaber will be more vibrant following E3 criticism. But it still won't cut limbs off.,1
AMD Ryzen 3000 Series Launch Megathread,1
So is EA going to remake battlefield 2142 or wut?,1
Black Mesa (Half-Life 1 Remake) - First 6 Minutes of Xen,1
Why does increasing FOV have almost a negligible impact on framerate compared to increasing resolution?,1
Fleet Carriers coming to Elite Dangerous this December,1
Ex blizzard employee gives insight on the failure of HoTS and the downtrend in blizzard as a whole,1
TennoCon 2019,1
Triternion's (Mordhau devs) official statement in regards to recent events,1
Kingdom Come: Deliverance - Victoria Hogan on Being Theresa,1
"New Vegas mod shows your character name, location, current action &amp; more to your Discord profile in real-time",1
Do you mind having to be always online for Hitman 2?,1
"'Farming Simulator,' 'Vampyr' lead Focus Home Interactive to record fiscal year",1
Stuck between Samsung 970 EVO Plus 500 GB SSD VS Crucial MX500 1 TB SDD for gaming and boot up.,1
"NVIDIA to announce GeForce RTX 2080 SUPER, 2070 SUPER and 2060 SUPER on July 2nd",1
"The Last Night update: ""we got UK video game tax credit on the line, they apologized for the massive delay, payment is on the way, we’re all good. We should have great news to announce in the upcoming months""",1
"Not a breakthrough, but maybe progress in terms of loot boxes in the UK.",1
VR Headset Sales for 2019 Are Already Impressive,1
CD Projekt Red has three teams working on three Cyberpunk titles (Polish Article),1
"When you download mods, how do you activate them?",1
"Metal Wolf Chaos XD now available for pre-order on GOG, exclusive GOG Galaxy themed skin",1
Does anyone else dislikes ultra sharp shadows?,1
"Is it true that publishers can sell Steam keys directly to customers without having to pay Valve the 30% cut? If so, isn’t Steam already a near perfect platform? Why is Epic behaving like the saviour of PC gaming?",1
PSA: The new AMD Ryzen 3000 series releases today.,1
GRID(Reboot) – Now Launching October 11,1
PUBG Corp. announce new studio Striking Distance headed by Sledgehammer's Glen Schofield,1
Wolfenstein: Youngblood will be the series first game to release uncensored in Germany,1
Jupiter Hell summons players for a weekend demo,1
Getting bored of games then going back to them?,1
What I Like (and Dislike) About Apex Legends Season 2,1
"Rumor: The next GTA is codenamed ""PROJECT AMERICAS""; inspired by Netflix's Narcos",1
Sea of Solitude Launch Trailer,1
"July 2019 PC game releases: Shadowbringers, Wolfenstein, Beyond: Two Souls, and more",1
Nintendo takes battle royale version of Super Mario Bros offline for a second time,1
"Tim Sweeney blames Valve for crowdfunding uproar, claims Steam ""traps crowdfunded projects"" on their platform",1
Wait for console specs before upgrade?,1
"The Sinking City - Game based on H.P. Lovecraft - Game Evaluation after 25 hours of gameplay, happy to chat about it.",1
Super Bunnyhop: Turning Life Into a Game for the Sims,1
HotS failed because – thanks to WoW – Blizzard was “too late” to react to Dota,1
Grimbeard - Pathologic 2 (PC) - Review,1
CRYSTAR Character trailer,1
What are your thoughts on Mafia 3?,1
Apex Legends Season 2 – Battle Charge Launch Trailer,1
Steam:Top Releases of May 2019,1
A unique horror game that puts you in the role of a late night radio talk show host who attempts to give advice to various callers who are being stalked by a homicidal maniac.,1
Former Blizzard boss discusses the death of Titan and the birth of Overwatch,1
"Developers talk on what they think of Xbox Game Pass: ""With Game Pass they're doing it correctly for the developers.""",1
"The Most ""American"" Games of All Time",1
User Benchmark Score discussion,1
Gamers Nexus: NVIDIA RTX 2070 Super &amp; 2060 Super Review: Killing Radeon VII,1
"Left Handed, undecided on what hand to use my mouse with once I get a PC.",1
"Due to a pricing error, PAYDAY 2 with all DLC is 94% off, making it about $5.",1
"Atelier Ryza: Ever Darkness &amp; the Secret Hideout is coming to the west on October 29, 2019 for the PC Steam.",1
Riot Games Refutes DFEH Allegations,1
LinusTechTips: Are Wireless Gaming Mice ACTUALLY Faster?? Testing with a 4K 1000fps camera.,1
Hollow Knight: Post E3 Wrap Up and Silksong Systems Update,1
"Valve needs your help testing ACO, a new Mesa shader compiler for AMD graphics!",1
The Division 2 still has secrets for players to discover,1
"ENCODYA free demo with 1 hour gameplay released on Itch.io for Win, Mac, Linux! Point'n'Click adventure game with stunning art! Have a try and let me know what do you think.",1
"""The option to play non-lethally may impact the multiple endings of Cyberpunk 2077."" With character customisation right down to sexuality, and the option to be a pacifist or lethal""",1
"The developers of Dying Light fixed complaints of ""poor optimization"" by reducing what the ""maximum"" settings actually did. People are less concerned with how a game looks, than whether or not they can play with settings ""maxed out"".",1
"G2A says it'll pay devs 10x the money lost on fraud chargebacks, if they can prove it",1
Disney’s Cold Iron Studios continues hiring for the next Alien game.,1
Bungie delays Destiny 2 patch to avoid crunch,1
[Giveaway] Giving away PUBG steam code,1
Two year prison sentence handed to perpetrator of DDoS attacks against Daybreak Games,1
"In 2014, Middle-Earth: Shadow of Mordor requires 6 GB of VRAM for ""ultra"" textures — how many games ask for even 8 GB or more now?",1
Torment: Tides of Numenera now available on Game Pass PC,1
Bandai Namco announces new Unreal Engine 4 MMORPG for PC - Blue Protocol,1
Can you get a $5 game for free with Bonus Savings Mode in the Steam Gran Prix event?,1
Universe Sandbox ² will have a Future Price Increase (From $24.99 to $29.99),1
"""GODS"" - Black &amp; White clone with support for VR. [Indiegogo]",1
The Hive - Alien insect army under your command!,1
"Take-Two wants quicker Rockstar Games releases, less content at launch, shorter gameplay",1
Logi(tech) Support is Terrible,1
"Victory At Sea Pacific - 1.5.0 New ships, New Factions",1
Post Scriptum - Steam Summer Sale - 40% off,1
The Microsoft store version of Metro Exodus is a fucking joke,1
"Risk of Rain 2:Scorched Acres Content Update has released; Adds new stage, boss, survivor and more",1
Why are there so few games about gangsters?,1
"GOG private policy, good? bad ?",1
[GIVEAWAY] The World is Your Weapon steam codes,1
"Total War: Three Kingdoms was the #3 best-selling game of May 2019 in the US, the first time a PC exclusive has ranked in the top 3 since Diablo III was the best-selling game when it launched in May 2012.",1
Cuphead – The Delicious Last Course – Teaser Trailer,1
Streamed Games and Preservation,1
tinyBuild responds to news of them restricting GOG updates due to piracy concerns,1
Black Mesa :: Some Release Dates,1
"""G2A do not care about the people who make games"", says Descenders Publisher",1
"Gylt, Google Stadia exclusive, may come to other platforms eventually",1
What is the problem with epic exclusivity?,1
Street Fighter's Queer Stereotypes Kept Me In The Closet,1
Cuphead devs say it would be a “dream come true” to make a Zelda game,1
"[GIVEAWAY] PC gaming, tough times, and the celebration that is Steam Summer Sale",1
"Cyberpunk creator Mike Pondsmith says 'everything is political', including his game",1
Gabe Newell on exclusivity in the gaming industry,1
[Givewayay] Call Of Duty Black Ops 4 - Humble Bundle,1
Mushrooms - Reveal Trailer,1
Stranger Things 3: The Game has released on Steam,1
Say what you want about Bethesda but their in game Customer service is brilliant.,1
Which series would you be more excited to see revived: Rise of Nations or Empire Earth?,1
NAVI REVIEW: Radeon RX 5700 and 5700 XT Benchmarks vs RTX 2060 + 2070 Super!,1
"Why on earth would RPS publish a ""Best Gaming CPU"" article 3 days before the release of Ryzen 3000?",1
A third of Cyberpunk 2077 PC pre-orders have been purchased through GOG,1
"Game Pass Is A Decent Business Model, But We’re Not Getting Paid Enough- Former Paradox Interactive CEO",1
Nintendo Switch PC Emulator Yuzu is already able to Run Super Mario Maker 2,1
Borderlands 3 “wouldn’t be as good as it is now” without Battleborn,1
Ja Mod STALKER Clear Sky,1
I think I figured out how to solve G2A,1
"This gaming chair is the only ‘Mercedes’ I can afford, but it’s still not cheap",1
"AMD competing with itself, consoles VS 200-300$ midrange PC GPUs",1
GreedFall releasing on September 10th 2019,1
Portal Bundle is crazy cheap on Steam atm,1
Skywind - 'Call of the East' Trailer 2019,1
Streaming games on pc/console,1
"Valve have released the CAD files for the Index VR system, enabling some fun modding",1
TaleSpire wants to be the digital tabletop roleplaying system of your dreams,1
"NVIDIA confirmed the RTX series to be launching with SUPER name on it (2080, 2070, and 2060)",1
Russian Defense Ministry Claims Metal Gear Video Game is U.S. Intelligence Project,1
Check Point Research: Origin patches flaw that could have exposed millions of player accounts,1
Visage — Early Access Announcement — New Chapter,1
Mighty Switch Force! Collection - Official Announcement Trailer,1
"Despite the deal with Epic regarding Shenmue 3, is it worth it knowing all the stretch goals (almost all of them) will be fulfilled?",1
"Twitch's new subscriber only streams appear to break the TOS of many companies if you play their games while in the mode including Riot, Blizzard, Valve, and more.",1
A review of ZED,1
Inside the intricate world of video game cartography,1
What do you do with old hardware when you upgrade?,1
Games showing Xbox icons while using a DS4 controller,1
Raziel sculpture from Soul Reaver,1
Song of Saya Remastered Coming to PC This Month,1
Valve to keynote US GamesIndustry.biz Investment Summit,1
How id built Wolfenstein 3D using Commander Keen tech,1
GOG Galaxy 2.0 combines all your game launchers,1
Ion Maiden announcement for July 11,1
"Netflix released photos for up coming series""The Witcher",1
How do I adapt to gaming on a PC?,1
Vici Gaming wins Dota Epicenter Major after 3-2 slugfest against Liquid,1
"@343Postums: Emails are prepped ✅ Users are selected ✅ Flighting is a Go✅ Blog is in final review ✅ Remember, the user group is small, but flight invites will go out within the next hour or two and then blog will go live later this afternoon after final reviews have been completed.",1
Valve Index Launch Party Speech,1
"Conception Plus: Maidens of the Twelve Stars coming west for PC on November 5th in North America, November 8th in Europe",1
CODE VEIN - Great Sword Weapon Trailer,1
GWENT: Novigrad Expansion Released,1
Death Mark's Successor NG is coming to the West on PC,1
Friday the 13th’s Steam Summer Sale Has Brought Jason Back from the Dead by Slashing 80% Off the Price,1
Final Fantasy 8 Remaster will feature English/Japanese voices according to its official website,1
"How a video game community filled my nephew's final days with joy(The Guardian, Elite:Dangerous)",1
Boundary - Teaser Trailer (New Astronaut FPS with Physics-Based Destruction),1
Final Fantasy 14 Servers Go Down Due To DDoS Attack Amid Shadowbringers Early Access,1
Druidstone Review (RPG Codex),1
Game Pass Ultimate is $1/£1 to upgrade your existing/new Gold subscription (Not monthly) - Ends in 2 days.,1
Rainbow Six Siege 3v3 western-themed showdown event is live,1
Advice for dealing with sweaty hands?,1
Rogue Wave: Sink them all! | World of Warships Battle Royale Mode,1
"History, Hate, and Trusting the Player",1
"Ryzen - How AMD saved PC Gaming, FORCED Intel to improve",1
Thoughts on Mist Survival?,1
The Walking Dead: The Telltale Definitive Series coming exclusively to Epic Games Store on September 10th,1
Instant gaming wanted my id,1
Early Ryzen 3000 adopters can’t play Destiny 2,1
Obsidian asserts The Outer Worlds is more 'humorous' than 'politically-charged',1
"God of War 3, Sly 3, P5 Persona, Dante’s Inferno &amp; more running on PC via the latest version of RPCS3",1
The human cost of Call of Duty: Black Ops 4,1
Monster Jam Steel Titans - Release Trailer,1
Pulang: Insanity Official Story Trailer,1
Developers telling people to PIRATE games instead of buying from G2A (since they don't get paid either way and would rather G2A not get any money),1
Gears 5 Versus - 4 Things To Know About Escalation,1
"What a re your thoughts on the massive rise of ""auto chess"" games with Underlords and Teamfight Tactics being so popular?",1
The old and new in Age of Empires 2: Definitive Edition: “we’re done adding civs”,1
title,pc_sub
Just built PC but can’t seem to finish all the games,1
So the rockstar games launcher,1
Shenmue 3 Kickstarter backers can still request a Steam key but getting one isn’t guaranteed,1
Early Access release date for Chernobylite announced (Oct 16) along with a video showcase of initial content,1
Borderlands 3 - DX11 and DX12 testing - 3900X + Vega 56 @ 3440x1440,1
GRID Preview - No Comment Gameplay,1
Game Pass Game Installation,1
PC Game Advice - Where did everyone go?!,1
Team liquid disbands (Dota),1
Conan Unconquered- Belit's Fury Update Now Available!,1
Commending Hell Let Loose,1
Why is checkerboard rendering still not available on PC?,1
Download the new Rockstar Games launcher and get a free copy of Grand Theft Auto: San Andreas,1
Current best modern FPS?,1
"Man of Medan: PS4 Pro vs Xbox One X vs PC Graphics Comparison, FPS Test And Engine Analysis",1
AI: The Somnium Files has released on Steam,1
Rebel Cops has released on Steam and GOG,1
UK Officials Say Loot Boxes Are Gambling In Damning Report - [Jim Sterling],1
You're going to need at least an RTX 2080 to get 1440p ultra 60fps from Borderlands 3,1
Anthem lands on Origin Acces Basic [PC] and EA Access [consoles],1
"Dota 2 players have been receiving absurdly long bans from the game, some even reaching up to two decades in length",1
Untitled Goose Game Launch Trailer,1
Infinity: Battlescape - Official Steam Trailer,1
How many of you like me use a controller for the majority of your gaming? (A few exceptions online competitive games being one),1
Katanakami Announcement Trailer (Way of the Samurai spin off),1
IGA still has plans to make Bloodstained a series,1
Far Cry New Dawn Benchmark - Proton vs Windows 10 (97% on Ultra),1
"What key do you prefer for ""interact"" in 3D story games, E or Left Mouse Button?",1
Control is everything I’ve waited for from Remedy.,1
Neo Cab - Release Date Trailer (October 3rd),1
Any good PC Gaming magazines or books.,1
Shadow Of the Tomb Raider is on sale on steam right now,1
WB Montreal teases new Batman game,1
GreedFall REVIEW - Solid Landing,1
PC Gamers: JRPGs or WRPGs?,1
Pc gaming hurts my body,1
Tom Clancy’s Ghost Recon® Breakpoint – Closed Beta to Open Beta Improvements,1
Battlestar Galactica: Deadlock - Resurrection details,1
"Troy, A Total War Saga confirmed",1
Assassin's Creed Odyssey: Discovery Tour,1
"EGS: 6 Free ""Batman"" Games / ""Metro 2033 Redux"" &amp; ""Everything"" coming next week",1
"Nioh 2 won't have an ""easy mode""",1
Steam Library Beta going live at 10am PST (3 hours from now),1
We need more games where you play as a truly terrifying monster.,1
Keyboard Shoulder Hurts,1
Call of Duty Modern Warfare Beta now available to preloadon Battle.net,1
Munchkin: Quacked Quest - Teaser Trailer (4 player Action co-op game),1
Report: Modern Warfare PC Beta Files contains many references to Battle Royale,1
The AI Games giveaway,1
What are some of the most memorable names you have run across in the online gaming community?,1
Anthology of Fear - Official Trailer,1
The Beast Inside | Release Date Reveal Trailer (October 17),1
"Star Wars Battlefront 2: New Planet, Modes, and Reinforcement — Community Update (Felucia, Co-op, and Instant Action)",1
Borderlands 3 outsells Gears 5 by more than four times in UK retail charts,1
You can now play Grand Theft Auto V offline again,1
Side platformer games control,1
Modern Warfare Open Beta has begun.,1
The gtx 680 is still a beast*,1
"Microsoft, its time to fix Games for Windows Live",1
Bloodstained available for download on PC Xbox Game Pass!,1
Train Simulator 2020 - OUT NOW!,1
Truck Mechanic: Dangerous Paths Trailer,1
Twitch acquires the Internet Gaming Database,1
"Thank you, EGS, for making PC gaming better by finally teaching us NOT to pre-order",1
SYNAPTIC DRIVE Announcement Trailer,1
WB Games says “capture the Knight” in a new Batman game teaser,1
The Vision Promises a Time-Travelling Adventure Like No Other - OnlySP,1
GRID | 'Get Your Heart Racing' Trailer,1
"Call of duty: Ghosts: What's the point of using 1080p resolution if you have to tinker with the ""image quality"" settings?",1
"Tech Support and Basic Questions Thread - September 22, 2019",1
Little Misfortune is out on GOG and Steam,1
Borderlands 3 has sold in 5 million copies after its first 5 days of launch making Borderlands 3 the fastest-selling title in 2K history and highest-selling title for the label on PC.,1
Detroit: Become Human - PC Teaser Trailer,1
US gamer jailed over 'swatting' death - eGamingDesk,1
Interview with John Alfonso Romero — the man who created Doom and Quake,1
"Free Talk Friday Thread - September 13, 2019",1
An issue with game gambling I don't see talked about.,1
Pc gamers - favourite live streaming platform for games?,1
The case around modification of software after sale,1
Borderlands 3 PC Graphics Comparison on Low/Medium/High/Ultra,1
Anti-aliasing at 1440p,1
"Suggest-A-Game Weekend Thread - September 14, 2019",1
Archeo: Shinar was fully released on Steam and GOG,1
Play all of Funcom's Conan games for free this weekend,1
Gears 5 has released on Steam,1
Shenmue III release date on steam shoes Nov 2020?,1
Succubus: Cherub Trailer,1
No Straight Roads TGS Trailer (Releasing 2020),1
Do people on this sub actually play/enjoy playing games?,1
Your rare achievements on Steam will now glow gold,1
What's going on at PC Gamer?,1
Borderlands 3 Review - Loot All The Guns,1
Can this idea for reducing latency on Stadia apply to PCs?,1
Untitled Goose Game review - Rock Paper Shotgun,1
"Gears 5 is a Bit of a Flop on Steam, Twitch, and Mixer",1
[Giveaway] Cities: Skylines,1
State of Decay 2 on PC?,1
Why has there been no advancement in character models in the last 6 years?,1
"112 Operator, sequel to 911 Operator, has a kickstarter and just released stretch goals. The game is already in alpha and so far I'm having lots of fun with it. Check it out.",1
Running modern games on a vintage CRT monitor produces outstanding results according to this article,1
DRM is really scary,1
Siege of Centauri - Release Trailer,1
The New Steam Library,1
"Conarium is now available for free on Epic Games Store, a Batman game will be free on September 19th",1
Do you think the Gamers demand for $60 and not adjusting to inflation is the cause of Microtransactions?,1
What is the Last Demo/Beta that convinced you to buy the game Day One?,1
Gaming ADD?,1
GTX 1050 Ti Benchmark | Assassin's Creed: Odyssey |Ultra Settings | 1080p,1
John Wick Hex Releases on October 8th on the Epic Game Store,1
"Codeweavers Interview about the history of Wine, Codeweavers' partnership with Valve to create Proton, and the future of gaming and software on Linux.",1
Dragon Audit - Announcement Trailer (Indie 3d game inspired by point &amp; click genre classics),1
Every Cyberpunk 2077 quest will be handcrafted.,1
"Milkdrop is back, but this time in Wallpaper Engine! Even though this isn't the Winamp plugin, it still really whips a llama's ass!",1
A Total War Saga: TROY - Campaign Map Reveal,1
Look out for Free MW Early Access Keys from Nvdia Geforce,1
Bungie ViDoc – The Moon and Beyond,1
Weekend PC Game Deals: Get overloaded on Caped Crusader adventures,1
DRAGON BALL Z: KAKAROT - Buu Arc Teaser (Release Date January 17th 2020),1
Ready Or Not (closed alpha) - Dev Blog 4,1
Weekend PC Game Deals: Get your horror fix before delving into space,1
I fear that the next Assassins Creed could be Epic Exclusive,1
"Player Spends $62,000 In Runescape, Reigniting Community Anger Around Microtransactions",1
What are your unbelievable experiences in games that nobody would believe?,1
"While I love Planet Coaster, Frontier's exploitation of consumer's with cheap DLC is sad.",1
PC gaming is about to die.,1
"Cobblin' Goblins - Sign up for the free beta (from Transhuman Design, developers of King Arthur's Gold)",1
Call of Duty: Modern Warfare cross-play will support mouse and keyboard on console too,1
Exploring Steam Jank: eBall,1
Mount and Blade II: Bannerlord beta invites going out.,1
Shenmue III backers may not get Steam keys after asking for them,1
GreedFall Review - PCGamer,1
"Last Oasis Developer Supports Epic Games, Looking Forward to Cloud Gaming",1
"Which games initially disappointed you, but eventually turned out great?",1
"Dead Cells Developer Teases Two More Years of Content, Possible Sequel",1
I took a 5 year break from PC Gaming. What are some big (or lesser-known!) games I should play?,1
"Capcom wins patent infringement lawsuit against Koei Tecmo, KT ordered to pay Capcom 1.34 million USD",1
Devil's Hunt is now available on Steam,1
Spending $60 On a Video Game Doesn't Make Sense Anymore.,1
"Next Major Mega Man Game Still in Development, Says series producer Kazuhiro Tsuchyia",1
"Take-Two attempts to shut down the ""Red Dead Redemption PC Remaster"" project",1
"If you're looking to play FIFA 20, be aware the game must not lose focus throughout the duration of an online match",1
PUBG - New Feature - Survival Mastery,1
Micro transactions added to Sea of Thieves,1
Batman Arkham Knight - Denuvo Vs Non Denuvo Comparison ( Tested at 1080p High and 720p Low ),1
In case you guys are on the lookout for active Commandos community...,1
Archeage Unchained Delayed - New Launch 15 October,1
MotorStorm Apocalypse | PC Performance Test | RPCS3 PS3 Emulator | 4K gameplay!,1
RPCS3 (PS3 Emulator) Progress Report: July 2019,1
Police Stories has released on Steam,1
