title,pc_sub
PSA: Remaster of Ni No Kuni uses post-fx fxaa. Complete Trash. Turn off.,1
hmm...suggest a good universal Server Browser?,1
What game(s) do you dream would be made ?,1
When are open world games considered completed?,1
Rockstar Launcher,1
A Knight's Quest | Official Gameplay Trailer,1
Cat Quest: Am I late to the Party?,1
Open-source cloud gaming service for retro games,1
The ESA Is A Big Piece Of Shit (The Jimquisition),1
Amazon finally have data server in Bahrain MIDDLE EAST!! which mean we will get better ping for those who live in Africa and ME region!! YAY!!,1
How do I get my wife to play more games with me?,1
Sparklite releases on November 14th,1
Black Mesa - Interloper Mini Update,1
"Anyone on here ever play the legendarily horrendous point-and-click game ""Limbo of the Lost""?",1
Wheel of fate is now on kickstarter!,1
Dark Envoy - Gameplay Interview,1
The High Court of Paris just ruled Steam's game resell ban illegal,1
Wheelchair and video games..,1
Final Fantasy XIV patch 5.1 reworks crafting and brings the first Nier alliance raid,1
Indie Developers Have Mixed Reactions to Steam Algorithm Update,1
Stronghold: Warlords - Alpha Demo Gameplay,1
PSA: Newest version of iCUE (3.19.120) pegs CPU's and creates game performance issues including stutter/fps drops.,1
40% Less Input Lag Without AMD Anti-Lag or NVidia Ultra-Low Latency - Batte(non)sense,1
New Batman Game Speculation Intensifies Following Fortnite Datamine,1
The 57 years of unseen work that built Cyberpunk 2077's Night City,1
Does anyone else avoid playing *any* new EA games released in the last few years purely because EA?,1
What gaming moments will you never forget?,1
Steam Community :: RAD :: Events :: RAD PATCH NOTES,1
Hitman 2 - Haven Island (New Map Maldives),1
Boxwrecker Arena is out on Steam!,1
"Free Talk Friday Thread - September 20, 2019",1
"Activision won't stop sending me Call of Duty e-mails, even though I unsubscribed *several* times",1
Romance of the Three Kingdoms XIV TGS 2019 trailer,1
Gears 5 is now available in mainland China,1
Subtitle presentation in games,1
"Tech Support and Basic Questions Thread - September 16, 2019",1
"Steam Store recommendation algorithms get an update, resulting in a greater diversity of shown titles",1
"Borderlands 3 Is Deleting Save Data For PC Players, Epic Store's Cloud Saves May Be The Culprit",1
Rainbow Six Siege: Operation Ember Rise – Amaru &amp; Goyo Trailer,1
"Anyone else feel like there's an increasingly noticeable disparity between what are considered ""graphically groundbreaking"" games and overall texture quality?",1
The Surge 2 - Launch Trailer,1
Origin Access. RipOFF.,1
Why is pc gaming so less social than console gaming?,1
"FYI borderlands 3 seems to be having a few problems at launch, including performance.",1
"Now that we have had a few days with the new Steam look, do you think it’s an improvement or not?",1
Here’s how new Steam Labs experiments will find better games for you,1
Gwent: Iron Judgement | Expansion Trailer,1
[SkillUp]Borderlands 3 - The Review,1
Pool: Shooting and recoil.,1
Enzai Shikkou Yuugi: Yuru Kill formally unveiled at TGS 2019,1
Rank the Quake games!,1
What websites sells cheap games and are trustworthy?,1
"Dwarf Fortress, An Easy getting started guide for beginners""",1
Disco Elysium - Detective/Mystery cRPG got a release date &amp; features trailer,1
"Gears 5 is being review bombed by Chinese users, due to the game being suspended/removed in China, most likely due to the game not meeting the Chinese governments requirements.",1
"Call of Duty: Modern Warfare to be Bundled with GeForce RTX Graphics Cards, PC's",1
PSA - Latest Windows 10 Update Causes Problems With Video Game Audio,1
Safe website for buying campaign only games?,1
Outer Worlds【TGS 2019 Trailer】,1
Subnautica: Below Zero Ice Worm Update,1
Control will receive two full (paid) expansions in 2020: The Foundation and AWE. Photo mode and new game mode Expeditions also revealed,1
"AI: The Somnium Files review - a bizarre story, masterfully told",1
Do you think porting bloodborne to PC would be a good financial move for fromsoftware? Personally I would love to play bloodborne on PC and I’ve got a ton of friends that feel the same and I feel like it would a good business move on their part.,1
Death March Club opening cinematic and gameplay footage,1
"Tech Support and Basic Questions Thread - September 13, 2019",1
is g2a legit,1
Devs of pcgaming: What was an awesome game concept that never got off the ground that you almost worked on?,1
"Devil's Hunt releases on PC, the first review is out",1
A new Batman game could be announced soon,1
"Is it possible to play FIFA 20, on Origin, with a Switch Pro Controller?",1
"Is anyone else playing Green Hell? This is by far the best ""survival"" game out there that I've played.",1
Are there any top selling PC game charts?,1
ANYONE playing COD MW on PC?,1
Hi I bought LEGO Star Wars The Complete Saga on Steam but didn't know they removed all the achievements on the Steam version. Is there another way to play it on PC that has achievements?,1
Linux 5.4 To Fix Many Newer 64-bit Windows Games On Wine / Steam Play,1
PC is such a shitty platform...,1
Can't digital media platforms create a single use license to avoid any reselling?,1
"League of Legends 10th Anniversary - Brand New Logo, Celebration Livestream on Oct. 16th",1
Marvel's Avengers | Hulk's Joe Fixit Outfit Reveal,1
How have GPU prices managed to stay at their inflated rates?,1
FIFA STREET 4 | PC Performance Test | RPCS3 PS3 Emulator | 4k 60 FPS,1
Why are gamers against microtransactions and loot boxes but are in favor of piracy?,1
"Remnant: From the Ashes updates to add ‘Adventure Mode’ on September 12, new dungeon on September 19",1
Untitled Goose Game Dev Explains Epic Games Store Exclusivity Decision,1
The cheat hackers 'ruining' gaming for others - BBC News,1
Publishers to keep releasing games with anti-consumer practices mean that the majority of gamers simply gave in into the temptation.,1
Somebody Forgot To Update NBA 2K20’s Taskbar Icon,1
SMACH Z - Tokyo Game Show 2019!,1
Planet Zoo Developer AMA | Wednesday 18 September 3PM BST/10AM EST,1
4th character for Slay the Spire is now available in the beta branch!,1
"Resident Evil 2 Seamless HD Project is a must-have overhaul mod; upscales textures, improves FMVs &amp; more",1
"Steam Agreement has actually been there for a while, Valve doesn't act upon it (SidAlpha's video)",1
Siege of Centauri Giveaway!!,1
Today in Dwarf Fortress.. Bloodsuckers of the Muck,1
Here are ideas for alternatives over keeping OR hiding games permanently in the Steam library.,1
Lightbearer - Launch Trailer,1
Steam Labs Update,1
New Guilty Gear Sol And Ky Trailer - TGS2019,1
Navi RDNA vs GCN 1.0: Last-Gen vs Next-Gen GPU Tech Head-To-Head! [Digital Foundry],1
Creature in the well is awesome!,1
"According to Polygon, Borderlands 3 has massive technical issues on PC: frequent crashes, quests glitching and more",1
Untitled Goose Game is out now on the Epic Games Store,1
How’s everyone enjoying Borderlands 3?,1
Maximum frametime recording,1
Borderlands 2 VR releasing October 22 on Steam,1
If i connect my ps4 controller to my pc using steam will there be any iunput lag?,1
The Dark Crystal: Age of Resistance Tactics - Allies and Adversaries Trailer,1
"After a secret experiment with 5% of Steam users, Valve changes the store algorithm",1
Borderlands 3 Reviews Based On Broken Unfinished Version Of The Game [Jimquisition],1
Rob Ager's top 100 video games of all time,1
Alternatives to Steam?,1
some steam keys,1
Tales of Arise TGS 2019 Trailer,1
The Epic Store library finally has a list view,1
Does anyone remember Blade of Darkness?,1
Is Borderlands 3 ever coming to steam?,1
John Wick Hex Release Date Trailer,1
After 2 years of early access: Die Young 1.0 RELEASED on Steam! (FPP/Survival/Female Protag),1
mouse/keyboard as a xbox360 controller?,1
Endless Space 2 - Free weekend &amp; Awakening expansion released,1
AMD Ryzen Boost Fix tested,1
"Game streaming startup Rainway raises cash, adds Gaikai founder and Xbox pioneer as advisors",1
Borderlands 3 cloud-save hotfix coming soon,1
Deliver Us The Moon Gameplay Trailer (Releasing October 10th),1
PCGamer Borderlands 3 Review (63/100),1
Atomic Heart: Official In-Engine Cinematic Trailer,1
Final chapter of indie hit Celeste signals toward a possibly transgender protagonist,1
Mistover Time Trial Demo Out Now,1
