title,pc_sub
Crackdown 3 Flying High Update (Official Trailer),1
"New games coming to Gamepass. Shadow of War, Dead Rising 4, Undertale, Blazing Chrome, My time at Portia and more",1
Super Buckyball Tournament is Coming to Steam Early Access Later This Year,1
Skyrim’s murky seas finally get an overhaul underwater mod after 8 years,1
Nvidia RTX 2060 Super/ RTX 2070 Super Review! Bringing The Battle To Navi!,1
5 Best Fallout 4 Mods of June 2019,1
Why Graphics Cards Cost MORE than EVER: Did AMD and Nvidia collude to fix GPU prices?,1
Elden Ring’s Gameplay Is Designed Around Its “Open and Vast” World,1
"Crunch is ""not sustainable"" but Blizzard wouldn't be Blizzard without it, founder says",1
DOOM Eternal....,1
Your Monitor Sucks. (ASUS PG35V Review),1
TaleSpire Kickstarter trailer looks promising.,1
"Sega EU on acquisitions, streaming, subscriptions, Atlus, Steam and EGS.",1
"First gaming benchmark, Final Fantasy XV, for the NVIDIA GeForce RTX2070 SUPER emerges (12% faster than RTX 2070)",1
"""We make zero money on our games if people buy them through ads and we then have to provide extra customer support for people who ended up with fake or deactivated keys. "" says devs on G2A bashing.",1
"Does anyone remember this old program.. (2005?) That was a radio app, it was shaped like a circle and the slogan was like ""music for gamers"" or something?",1
PC gaming is in a decline and deserves to be - MarketWatch,1
REMINDER: Xbox Game Pass for PC. Unlimited access to over 100 high-quality PC games for an introductory price. £3.99/month. Current price is £1.00 75% off • 2 days left of introductory price.,1
[PSA] Today the Coinstar Machine at the grocery store I go to started using Steam as a form of payment.,1
Blood (1997) | Forgotten Gems (with Creator Nick Newhard),1
Old School Runescape is “a good creative beta” for modern Runescape,1
Steam Blog :: Behind the Scenes at the Summer Sale Grand Prix Races,1
"Nostalgic, Cinematic Platformer Horace launches on Steam on 18th July - Wishlist Now!",1
Anyone here ever use the Razor Orbweaver or Tartarus if so how did you like it?,1
How scared should I be of games disappearing from the pc game pass? [microsoft],1
"Oculus Rift S Patch Dramatically Improves Controller Tracking, Coming To Quest In Future",1
"Effective immediately, all Zachtronics games are free for public schools and school-like non-profit organizations.",1
What games have you beat in 2019?,1
Game streams are pointless if the streamer is popular,1
NVIDIA GeForce RTX SUPER series final pricing and availability date leaked,1
Top 20 Best Steam Summer Sale Games Under 5$!! (With links),1
"Why is it taking so long for a new Star Wars open world mmo to be developed? I’m taking monthly subscription, passionate developers, and multiple platforms.",1
Sharing screen and control over my computer,1
How do I get good,1
Indemnification?,1
DOOM,1
One Punch Man: A Hero Nobody Knows Announcement Trailer,1
"G2A: key reselling is a problem for some developers, “but not for us or anyone else”",1
"Update 36: Progress update, Steam Page, and More! · The 13th Doll: A Fan Game of The 7th Guest",1
Iceborne will conclude Monster Hunter: World's story,1
What game/games do you think would have the highest average IQ among their playerbase?,1
"AMD vs Nvidia inputlag comparison, AMD rep leaves comment saying it will get even better",1
Dell G3 3590 Non-professional Casual review,1
How would you rate this year so far in terms of quality games?,1
Will PC gaming as we know it change once we move to cloud gaming ?,1
My lord...is that legal?,1
Top Steam Summer Sale Games Under 1$ Part 2!!! 50 More (with links),1
To those who have played with Xbox Game Pass already; Any issues ran yet?,1
The Steam Summer Sale Grand Prix game is confusing the hell out of everyone,1
W40K: Inquisitor | Patch 2.0 Release Trailer,1
CD Projekt says it's not actually working on multiple Cyberpunk games,1
How to find PC games?,1
RUNE II: Loki's Ages of Ragnarok Spotlight,1
Steam Grand Prix Summer Sale is Live,1
"Halo SPV3 v3.2, the Halo 1 campaign overhaul mod which adds new levels, weapons, vehicles, enemies, improved graphics, 4K support, 60fps animations and much more has finally released!",1
SolSeraph | Announcement Trailer,1
SOEDESCO opens its second game development studio today,1
"Update on Steam, Ubuntu, and 32-bit support",1
Imperator: Rome - Pompey Update Feature Breakdown,1
"Tech Support and Basic Questions Thread - June 27, 2019",1
"Played Wildlands, Origins, Far Cry 5 for 2-3h and i don’t know what to say.",1
GRIP: Combat Racing | Summer of Combat,1
Hunt Showdown | Bad as They Seem,1
The Addictive Cost Of Predatory Videogame Monetization (The Jimquisition),1
"Atelier Ryza - Trailer with Battle, Alchemy &amp; Exploration Gameplay. Coming out on October 29",1
"Prison Architect surpasses 4 million players (across all platforms), New Update the Clink releases today",1
G2A attempts to place sponsored articles with no disclosure to raise awareness with indies/smaller devs,1
Fall Guys: A Unique Battle Royale Game With No Weapons,1
"Tech Support and Basic Questions Thread - July 03, 2019",1
How much of a disadvantage are you at playing a FPS online with a controller?,1
"My Friend Pedro — version 1.02 released (uncapped frame rate, improved support for ultrawide aspect ratios...)",1
The new Valve Index-Controllers are shipping out with hardware defects.,1
Devotion’s Chinese publisher has had its business license revoked,1
"Tencent, Chinese gaming companies push new age rating system",1
"Tech Support and Basic Questions Thread - June 30, 2019",1
My recommendations for the current Steam Summer sale,1
Reminder: There are only a few hours left to get the latest Borderlands 2 DLC for free (ends at 07:00 PM UTC),1
"Thousands perish in Elite Dangerous expedition, but survivors reach the edge of the galaxy",1
"Free Talk Friday Thread - July 05, 2019",1
TIL there is a Redwall game series...The Lost Legends of Redwall: The Scout,1
Let’s make an epic gamer moment Corgis,1
"""Accurate"" E3 Demos - Raycevick",1
"Alienware co-founder leaving Dell, rumored to become AMD’s first chief gaming officer",1
GTX 1660 Ti vs RX Vega 56 – 1440p Gaming Graphics Card Showdown,1
What game was the best VALUE for you?,1
"Quadplay is a newly released, open source (LGPL) fantasy or virtual console from CasualEffects, it's amazingly well documented and already quite full featured and of course completely free.",1
"Out of curiosity, how many Steam games do you have?",1
Cyber Hunter Pc Version,1
"Katherine Castle(RPS) just published six CPU reviews including ""Intel Core i5-8400: Still a great Ryzen 5 killer"", ""Intel Core i5-9600K: Our new best gaming CPU champion"", ""Intel Core i7-9700K: The best gaming CPU that doesn’t break the bank"" and ""Intel Core i3-8100: A great entry level gaming CPU""",1
Control | 26 Minutes of PC Gameplay w/ Ray Tracing Enabled,1
"Gabe drops Half-Life 3 hints during Valve Index party, because of course he did…",1
Night Call will release on Steam and Xbox Game Pass on July 17th,1
"Project Boundary officially titled Boundary, PC version is being considered",1
Bloodstained: Ritual of the Night is 30% off ($28 USD) currently on Green Man Gaming (Steam/PC),1
Borderless Gaming 9.5.6 released on Github (various bug fixes),1
Ni No Kuni 3 is in development,1
Steam page for Code Vein is live! It's finally happening.,1
What game gave you the most value for your money?,1
With so many action games and especially shooters you read complaints about poor AI. What action games are considered to actually have good AI? And what makes it good?,1
Call of Duty: Black Ops 4 Pay to Win Feature Added Into Blackout in Latest Patch,1
"AMD to Slash Radeon RX 5700 ""Navi"" Series Prices Ahead of Launch: $399 &amp; $349",1
22 of the worst PC games of all time,1
Ex-Fortnite Reddit mod accuses Epic Games of paying mods to manipulate posts,1
Scientific mousepad friction testing: Glorious Helios Glide Test vs AMP500 vs Cooler Master MP510 vs HyperX Fury S Mousepad Comparison,1
"For Honor - Tribute, The Forgotten Mode [By showing players how (in)active the mode was, Ubisoft accidentally ensured no one would queue for it again]",1
NG (Death Mark Sequel) coming west for PC in October,1
eFootball PES 2020 Demo includes Edit Mode and 14 real teams,1
Steam Controller 2 patent and mention in Steam Input files found.,1
Ja Mods - Resistance &amp; Liberation Open Beta 1.6,1
"EA sees Bioware's Anthem on ""seven to ten year cycle""",1
"What Are You Playing Thread - July 02, 2019",1
Gloomhaven - Early Access Teaser Trailer,1
"I am genuinely curious. If NVIDIA destroys AMD Graphics Cards at almost every launch, who exactly is NVIDIAs competition? More to the point, how come AMD still has a market?",1
Wolfenstein: Youngblood will be using the Denuvo anti-tamper tech,1
Using MTG playmat as a mouse pad,1
Call of Duty Modern Warfare will let you reload while aiming down sights,1
Borderlands 3 - Claptrap Presents: Pandora,1
Behind the Scenes with the Games Media at E3 2019,1
Risk of Rain 2 - Scorched Acres Update Trailer,1
Cyberpunk 2077 System Requirements,1
S.W.I.N.E. HD Remaster | Rabbit Army Trailer,1
Top Gear Has Arrived in Forza Horizon 4 - Trailer,1
The Surge 2 - Dev Gameplay Walkthrough,1
Metal Wolf Chaos XD launches August 6,1
"If I own a game on one platform (e.g. Steam) and it becomes free on another platform, are there any pros or cons to redeeming it there too?",1
Returning to PC gaming - what have I missed?,1
Microsoft is “not going to leave Age of Mythology behind”,1
A Brilliant FPS - Insurgency Sandstorm Review,1
CODE VEIN - Opening Cinematic,1
One Piece: Pirate Warriors 4 Announced For PC In 2020,1
Refused Is Officially the Sound and Voice of Cyberpunk 2077’s SAMURAI! - CD PROJEKT,1
Weekend PC Game Deals,1
PSA: You don't need to remove games from your Steam wishlist in order to win your Top Wishlisted Game during the Steam Summer Sale - just move your favorite game to the top of your wishlist and you're good to go!,1
Hunt: Showdown leaving early access on August 20 for PC and Xbox One,1
EVE-Online NPC's Threatening Player Owned Assets &amp; Invading,1
"Valve is not your friend, and Steam is not healthy for gaming",1
Starbase - The Next Big Space Game? Everything We Know So Far! (Obsidian Ant),1
Who does 'First Impressions' type videos nowadays?,1
"Paradox Interactive: ""The 70/30 revenue split is outrageous""",1
What’s your favorite ultrawide gaming experience?,1
Rising Storm 2: Vietnam - Green Army Men DLC trailer,1
Children of Morta Impressions,1
"I always found level editors in games to be either restrictive or difficult to use. So I'm trying to make one which is easy to pick up, based on spline curves. This is what I have so far",1
Silver Chains Release Trailer,1
Square Enix Dragon Quest XI team hiring for next-generation Dragon Quest title,1
PC games with the worst FMV video encoding?,1
"First gaming benchmarks for the AMD NAVI GPUs, Radeon RX 5700XT &amp; RX 5700, have been leaked online",1
This gorgeous Star Wars Battlefront III Fan Remaster will not ever be released to the public,1
Had the chance to play Dota Underlords when opened for BP owners. Here is my evaluation after 25 hours of gameplay. Happy to chat about it.,1
Artifact designer thinks it can be saved but isn't interested in doing 'damage control',1
"Asus PG35VQ Review, The Great Wallet Destroying 200Hz HDR Ultrawide Monitor",1
Old School Runescape ends partnership polls early after community backlash,1
Bandai Namco announces online action RPG Blue Protocol for PC,1
Edge of Eternity: Chapter III will be releasing on July 17th,1
CD Projekt Red has three teams working on three Cyberpunk titles: - Cyberpunk 2077 - CDPR's next big game and a rumored standalone Cyberpunk multiplayer game,1
"Suggest-A-Game Weekend Thread - June 29, 2019",1
Robotics;Notes Elite announced for Steam,1
EVE Online players threaten to quit as devs announce local chat blackout,1
AMD has just 14.75% of gamers on Steam using Radeon graphics,1
ACE Team — SolSeraph announcement,1
Frontline Zed - Official Trailer - Spiritual Successor to The Last Stand flash game,1
"Warframe's intro cinematic debuts 6 years after the game came out, but at least it's pretty rad",1
Are Physical P.C games still made or is it all downloads from steam. I can remember when Best Buys p.c. games were as big as the xbox titles.,1
Only have time for one. FFXIV or Destiny 2,1
This community rocks and I have to thank a member.,1
Amid Evil review - Civvie11,1
Need for speed underground.,1
Cyberpunk 2077 has three different playable prologues depending on your starting choice,1
Builders of Egypt - Official Trailer,1
Gamer lefties of Reddit: What are your keyboard controlls?,1
GOG Galaxy 2.0 may be what PC gamers need to unite all launchers,1
Is there a way to take Pedals (like Thrustmaster) and have them trigger Macros?,1
"Monster Hunter World: "" We've finally built a great base to work from""",1
‘Rage 2’ is somehow selling way less than ‘Rage 1’ so far,1
Reminder: Steam Summer Sale starts tomorrow at 10AM PST,1
I installed Hollow Night via Gamepass for PC and when I opened it for the first time it already had a save slot made with 14 hours logged,1
Langrisser I &amp; II coming West in early 2020.,1
PSA about Pinnacle Game Profiler,1
Is 7days to die still worth it after alpha 17.,1
MythBusters: The Game - Official Trailer,1
Steam: Buying Borderlands 2 (Blocked in this Country),1
"Gears 5 Versus Technical Test details have been revealed, including Recommended Specs for PC",1
AMD Fidelity FX Review - Featuring RAGE 2 - Is FidelityFX a gimmick?,1
PSA: The Steam Summer Sale 2019 goes live in exactly 1 hour and 30 minutes from now!,1
"PSA: Players are receiving the error message: ""YOUR ACCOUNT HAS BEEN ACCESSED FROM ANOTHER LOCATION"" upon login [on Uplay]",1
Rebel Galaxy Outlaw - In-Game Gameplay and Ship Combat,1
Earth Defense Force 5 coming to PC on July 11,1
Petition to “Stop Selling Indie Games on G2A” Gains Traction Faster Than Expected,1
OpenCritic might add a “crunch meter” to document devs’ work/life balance,1
My Pre-ordering conundrum ?,1
Rampant racism and toxicity are driving players away from Mordhau - PC Gamer,1
Unreal Engine developers are getting FEM Physic Simulation/System.,1
"Obsidian’s creative director, Leonard Boyarsky has said the studio doesn’t want to create a “politically-charged” game with The Outer Worlds.",1
"Tech Support and Basic Questions Thread - July 06, 2019",1
Skywind total conversion mod gets an impressive new trailer after 7 years,1
"""Atelier Ryza"" official English website is online. Releasing on October 29th.",1
The upcoming “immersive” Evil Dead game will not be VR,1
New gaming headset from Audio Technica,1
"Epic funding Kickstarter refunds resulting from Shenmue 3’s move to the Epic Games store, says it'll do likewise when future crowdfunded games switch to Epic Games store exclusives",1
"This year has been my first Steam Summer Sale, and it is my new favorite holiday.",1
How gender questioning and transgender gamers found a safe space in VR,1
"NVIDIA’s next-generation GPUs, coming out in 2020, will be using Samsung’s 7nm tech",1
Keanu Reeves has made Cyberpunk movie ‘much more of a possibility’,1
theHunter: Call of the Wild - Yukon Valley Trailer,1
It appears that contraversal Black Ops 4 boxes in BR mode are only avaliable in limited time modes,1
Predictions for Cyberpunk 2077 Recommended Specs,1
What games did you buy during Steam Summer Sale and have any stood out as amazing? For me? Katana ZERO,1
Blizzard is hiring Hearthstone community managers – having laid the whole team off five months ago,1
Website with played games library,1
"The Dark Souls of Shooters, Part 1 - Which elements of Witchfire are inspired by From games?",1
F2P games like Arma 3?,1
Temtem - Alpha Access now live on Discord,1
What Are Your Favorite Old PC Games?,1
Treyarch reportly are frustrated with activisions quest to get more revenue with micro transactions,1
Where are the Transformers games for PC?,1
Leaked Ryzen 5 3600 Benchmark Claims Better Single-Threaded Performance Than the Core i9-9900K,1
HYPERCHARGE: Unboxed - ToyRex Content Update | Out Now,1
JUMP FORCE - Bakugo DLC Trailer,1
Housemarque CEO: Sometimes You Need Exclusive Deals Because Money Doesn't Grow on Trees,1
"The Witcher 3 HD Reworked Project 10.0 Reborn releases on July 17th, new comparison video released",1
Half-Life remake Black Mesa has a partly playable Xen chapter,1
What are your unpopular opinions in gaming?,1
I've beaten the story of Kingdom Come: Deliverance. What next?,1
What do you consider as the best game that was a tie-in or based on a movie or TV show?,1
Does my PC have to be in a bag for carry-on for a flight?,1
Halo MCC Development Update - June 2019,1
I think this is really relevant to this forum.,1
Star Wars Jedi: Fallen Order — Official Gameplay Demo (Extended Cut),1
Remedy now owns the publishing rights to Alan Wake,1
The Game That Tears Relationships Apart Is Free At Epic This Week,1
Rise Eterna Trailer (New SRPG coming soon to Steam),1
Red Dead Redemption 2 for PC found in Social Club source code,1
Anyone else feel like this Steam event is crap?,1
Aperture hand lab - New free VR game by valve,1
Nutaku announce $5 million investment in LGBTQ+ games,1
"Borderlands 2 VR For PC Rated By ESRB, Suggesting Release Nears",1
"Halo: Combat Evolved SPV3.2 mod released, features improved graphics, gameplay and new missions",1
Black &amp; White,1
Is PC gaming on Medium settings an enjoyable experience?,1
CODE VEIN - Successor of the Ribcage Boss Trailer,1
Steam vs Epic Games Store: the logics of digital distribution on PC [Italian Article] [English Transcript in the comments],1
Hearthstone New Expansion: Saviors of Uldum,1
Take-Two CEO Says Not Every Game Needs To Be Massive 100 Hour Experience,1
Microsoft to bring back Age of Mythology,1
Forza 7 missing from new Xbox App,1
What games you buying steam summer sale.,1
"Green Hell Leaves Early Access on September 5th, 2019",1
Hardcore Playing The Witcher 3,1
Zombie Army 4 devs on Epic exclusivity: “upsetting a few people isn’t necessarily bad”,1
"The Developers of Last Oasis, Donkey Crew Will Be Having an AMA With Us July 3rd at 3:00 PM EST!",1
You should know: how to DIY cloud save any game across any computer,1
"Limbo and Inside reviews (2.5D Cinematic Horror Platformers Pt. 1) (audio, review, podcast)",1
Why have PC games have stagnated in terms of graphics?,1
"Anybody playing Outward got any beginners tips, im an avid Skyrim and Divinity player but this is something ive been wanting to master for a while",1
"Mike Rose on Twitter: ""G2A has taken out sponsored ads on Google... and we make zero money on our games if people buy through the ads.""",1
More than a million people per month are still playing Age of Empires,1
Is 'noir' is a popular theme among indie devs right now?,1
"Ubisoft donating €500,000 to support the restoration of Notre-Dame as well as giving away AC: Unity for free on Uplay for a week",1
Rami Ismail joins Descenders developer in calling players to pirate their games rather than buy from G2A,1
Humble Monthly Early Unlocks: Kingdom Come: Deliverance and Surviving Mars,1
The Rusty Lake series has been released on GOG,1
AMD Launches Xbox Game Pass for PC Bundle for Current Radeon &amp; Ryzen Products,1
IT STARES BACK PROLOGUE LAUNCH TRAILER,1
Anyone Still Rocking the Max Payne Mousepad?,1
Who does not remember Pharaoh (from Sierra) on PC in 1999? Here is the new trailer of Builders Of Egypt!,1
How many of you actually regularly or primarily play on your TV?,1
Steam Summer Sale 2019: The best deals I got for $50,1
"Mordhau r/pcgaming follow-up: Based on comments about ""it's not racist/not offensive/free speech,"" and ""it's just teens being edgy but they're not really racist,"" I decided to ask subreddits for minorities, LGBTQ, and women if they accepted the above ""explanations.""",1
Dragon’s Dogma Online game ends service on December 5 in Japan,1
"People who are still playing Battlefield V, what's it like? Is it worth getting into?",1
"tinyBuild Withholds Patches, DLCs and Bonus Content from GOG Due to Piracy Concerns.",1
Assassin's Creed Odyssey final DLC (Judgement of Atlantis) is releasing July 16th,1
In Depth game Reviews??,1
Steam works wonders for the retail PC market,1
"Re-logic, makers of Terraria state that they will never take an EGS exclusive deal and liken it to selling their souls",1
Quake Champions' olde school guns demo'd: Nail Gun. Super Shotgun. Heavy Machine Gun.,1
"Metal Wolf Chaos XD - Coming August 6, 2019",1
Shenmue 3 System Requirements Revealed; Requires 100 GB of Storage,1
Tim Sweeney says it’s Valve’s fault that backers won’t get Shenmue 3 Steam keys,1
New calculation,1
How would you rate this decade for gaming?,1
"Let's talk Optimization: What are your specs, and what balance of detail, resolution and frames do you try to achieve?",1
Does anybody know if there is a way to get custom big boxes made?,1
What I Like (and Dislike) About Krunker,1
Postal 2 Giveaway,1
DAYMARE: 1998 Gameplay Demo (New Survival Horror Game 2019),1
D.R.O.N.E Starter Edition is now free on Steam,1
Mount &amp; Blade II Bannerlord: Multiplayer Beta,1
Sounds like Hitman 2's bank stage has released!,1
Last Day of Jume now free on Epic Games Store,1
The death and return of City of Heroes | PCGamer,1
How do I explain to my parents that I can't pause my online game,1
Levelhead Patch 0.8: Rickety Relay,1
Logitech keyboards and mice vulnerable to extensive cyber attacks,1
"Planet Explorers networking code got deleted from it's server, didn't keep backups of the configuration or code for the servers. Going F2P next week with NO multiplayer, instead they are starting from scratch on Planet Explorers 2",1
"This game looks amazing , like gta but better",1
Microsoft may actually be committed to PC gaming this time,1
AMD bundles free Xbox Game Pass for three months with processors and video cards,1
Black Closet or Cultist Simulator,1
PC is the most-nominated platform in the Best of E3 2019 Game Critic Awards,1
Shenmue 3 offers refunds and delayed Steam keys over Epic exclusivity,1
"Xbox Boss Phil Spencer Talks About Giving Halo, Forza Teams Extra Time To Make Great Games",1
Does 240Hz Matter for Gaming ft. Gav from The Slow Mo Guys,1
Final Fantasy XIV is “experiencing technical difficulties due to a DDoS attack”,1
"Slay The Spire’s fourth character will be free, working on additional free content",1
Desperados III - Closed Beta Announcement Trailer,1
"Free Talk Friday Thread - June 28, 2019",1
"Magic: Arena adds a battle/season pass, gets it all wrong with daily XP caps",1
Taiwanese horror game Detention is getting a film adaptation,1
Partnerships and Old School,1
Weekend PC Game Deals - Steam Summer Sale Edition :),1
Could my 1080 Ti possibly be re-sealed?,1
“Alpha Omega”: Aether Returns – Official Call of Duty®: Black Ops 4 Zombies Video,1
AWAY: The Survival Series | Gameplay Sneak Peek,1
Halo: Reach PC 4K Playthrough | Tip of the Spear,1
HITMAN 2 July Roadmap 2019,1
The GeForce RTX 2070/2060 Super review. RTX2080 performance for almost $200 cheaper,1
ZOTAC Announces Its GeForce RTX SUPER Lineup of Graphics Cards,1
Apex Legends - Season 2 Trailer,1
"Suggest-A-Game Weekend Thread - July 06, 2019",1
Age of Empires II: Definitive Edition - E3 Demo,1
Official Call of Duty®: Black Ops 4 — Operation Apocalypse Z Trailer,1
FINAL FANTASY XIV: Shadowbringers has released on Steam,1
Black Ops 4 reaches new low,1
"eFootball PES 2020 Demo out July 30th, includes Edit Mode and 14 real teams",1
And AMD keeps frustrating intel chips: Ryzen 7 3700X beats Intel Core i9-9900k in several key tests,1
Knights of the Old Republic with a 3GB character overhaul,1
Warframe | TennoCon 2019 - trailers and announcements,1
What are your thoughts on Ubisoft's games?,1
Gamasutra - Age of Empires series brings in over 1 million players each month,1
Ars Technica got their hands on an RTX 2060 Super and 2070 Super and did some preliminary benchmarks,1
Battlefield V Bug Is Still Making Players Invisible,1
Nvidia’s New SUPER Cards!,1
[Global Giveaway]Velocifire Mechanical Keyboards+ PBT Keycaps,1
The Dark Pictures: Man of Medan - Who is Conrad? Part 1,1
Blizzard Responds To Accusations Of Censorship In Hearthstone's Latest Patch,1
G2A says “sellers would move” in response to petition asking it to ban indie sales,1
We're Donkey Crew - International team developing a nomadic game Last Oasis coming September 3rd. AMA!,1
Divinity: Fallen Heroes is a tactical RPG that blends the world of Divinity: Original Sin 2 with the action of XCOM,1
BEYOND: TWO SOULS OFFICIAL PC TRAILER [EN],1
My thoughts on G2A's official response,1
Epic CEO Tim Sweeney says exclusives “ultimately benefit gamers”,1
"PARANOID - ""The Room"" Trailer (new Game from Madmind Studio, Makers of Agony)",1
GTA VI Might Be Console Exclusive: PlayStation and Xbox Gamers are in for a Treat,1
How Diablo was completely Reverse Engineered without Source Code | MVG,1
"My Friend Pedro has sold 250,000 units in its first week",1
"Upcoming Strategy game, looks very similar to Imperator Rome with the possibility to play out the battles!",1
"Giveaway: Humble - Kingdom Come, Surviving Mars, Mechanicus, Hellblade, Tannenberg, Red Faction",1
Halo Reach Beta Information?,1
Where does the Xbox app store game saves?,1
Langrisser I &amp; II coming to PC early 2020,1
Black Mesa - Xen Technical Beta,1
Digimon Story: Cyber Sleuth &amp; Digimon Story: Cyber Sleuth - Hacker's Memory is coming to PC on October 18th as a 2-in-1 pack.,1
"Dinkum is an Aussie-themed Sandbox Game, Coming to PC in 2020",1
Chat with Al Lowe of Sierra/Leisure Suit Larry fame,1
Are there any games where the sniper scope doesn't move when you breathe?,1
