title,pc_sub
"Intel raytracing tech for all DX 11 cards and above. Limited in scope, though.",1
What are your thoughts on G2A?,1
X4: Foundations - Version 2.60 Public Beta 2 is now available,1
Planet Zoo Developers - AMA!,1
Kind Words (lo fi chill beats to write to) has released on Steam,1
Why does Wolfenstein II: The New Colossus use pre-rendered cutscenes?,1
"PSA: Things labled as ""gaming"" are almost always crap",1
Dwarf Fortress: Villainous Networks and Investigations,1
Session - Early Access Launch Trailer (Out Now!),1
GreedFall has released on Steam,1
Half life 1 or 2?,1
"ESA ""strongly disagrees"" with UK DCMS loot box report",1
"Borderlands 3 Optimization, Fix Low Framerates With Virtually No Visual Downgrade - Hardware Unboxed",1
"Older gamers (30+), which games in last 5 years did you enjoy the most?",1
"I miss the magic of 90s PC gaming so much, what actually happened?",1
"New NEOGEO Arcade Stick Pro includes 20 fighting games preinstalled, can be plugged into a PC",1
"""as long as it doesn't affect gameplay I'm ok with micro transactions"" while paying $60 for a game",1
The making of Gears 5: how the Coalition hit 60fps - and improved visual quality,1
Sharpening filters should ALWAYS be available in game options when TAA is the devs preferred AA method,1
Outbuddies launches October 15 on PC,1
AMD APU 3400g is great for budget gaming. Gears 5. Close to 60F FPS at 1080p.,1
Dragon Ball FighterZ DLC character Gogeta (SSGSS) launches September 26,1
Dirt Rally is free to keep on Steam for a limited time,1
Google Stadia Founder's Edition is nearly sold out,1
Iron Harvest: Beta-backers can now play and join supporters-only Discord,1
Nintendo sues another ROM site for “brazen” copyright infringement,1
The Surge 2 review - Not quite a rush,1
Am I the only one hate new fps games because of this?,1
Shenmue 3 Refund Refused to Backers Who Switched From PC to PS4,1
"Cod MW beta, how these gaphics acceptable in 2019 ?",1
The Offspring to Perform Inside 'World of Tanks' Online Game,1
Free weekend for Deep Rock Galactic!,1
It's just a launcher - a rant,1
‘Shenmue 3’ Refunds Begin Soon,1
What is your “main” pc game?,1
Larians Great Valve Heist [How Larian got cross-platform saves for Divinity Original Sin 2 on Steam/Switch],1
"Gonna be frank, Sonic mania is the shit! Have a steam key for it.",1
To those wondering how digital reselling can work for Valve check out this Extra Credits video. Digital reselling has been on the cards since the EU ruled that digital products were owned by the consumer.,1
Romancing Saga 3 releases November 11 on PC in the West,1
"Borderlands 3 PC players are dumping on the game, in Bordelands 2’s steam forums.",1
"Apple just signed the sequel to the 95% rated Steam game ""Enter the Gungeon"" as a (timed?) exclusive to their new game subscription service.",1
"New Control patch to be released later: ""Improved general frame-rate performance through optimisations made to multiple systems and content. Improved title stability on all platforms""""",1
"[PC Gamer] ""PlanetSide Arena's 240-player battle royale is pure chaos""",1
Nier Automata,1
"Which game / franchise would you like for it to be developed by another company? For instance, Borderlands by CDProject, SW Battlefront by Bungie, etc",1
Freeware games curation resource?,1
Red Dead Redemption 2 PC Denied Classification Twice In Australia,1
"With the new cod being cross play, how can I talk to my friends on console?",1
Crying Suns has released on Steam and GOG,1
Discord Nitro subscription service drops games,1
Call of Duty: Modern Warfare and the Cruel Realities of White Phosphorous,1
Devil's Hunt - Launch Trailer [PC],1
Open world indie game Hardland is released today,1
Ni no Kuni Wrath of the White Witch Remastered has released on Steam,1
Lakka 2.3 released - with RetroArch 1.7.8,1
"So, do you think the amount of shovelware on Steam such as 'asset flips' will result in second video game crash?",1
New Hell Let Loose Trailer - Come Join the Pre-market Fun!!!,1
Best upcoming games in 2019,1
The best teaser trailer for a video game ever.,1
The Surge 2 - Symphony of Violence Trailer,1
User review sites for games?,1
Which is a bigger advantage in competitive gaming? Ultrawide Monitor vs Higher framerate monitor,1
Anyone know of a good crpg to play,1
"Chinese gamers are review-bombing Warframe because apparent the ""Country"" settings seperater China from Taiwan and Hong Kong.",1
What is your one biggest defining moment out of all the games you've played?,1
Signal Decay Trailer[Early Access Launch],1
"ESA proposes rebranding E3 2020 as ""fan, media, and influencer festival"" in leaked document (10,000 additional tickets for consumers)",1
The Bradwell Conspiracy - Reveal Trailer,1
"So, KFC just announced Colonel Sanders dating simulator",1
Do people still care about the Box art?,1
Bloody Rally Show - violent old school 2D racing,1
OPINION: Games Journos are wrong to want an easy mode in all games,1
ZeroTier,1
Halo: Reach Evolved Version 2 mod coming to MCC (Master Chief Collection) when it releases on PC,1
PC gamers: Are you buying a Nintendo Switch (Lite)?,1
Modern Warfare (2019) Early Access Beta Code Giveaway,1
Wasn't Valve supposed to announce their new VR game at Digipen today?,1
BATTLETECH - 1.7 Update Release Notes,1
AI: The Somnium Files | Release Trailer,1
"Heaven &amp; Earth mod, for CMSF2, presents 'The Delta'",1
Bug or extreme graphics dumbdown Call Of Duty MW Beta on PC,1
Which video game scenario would you want to see on the movies,1
Grandia HD Remaster for PC delayed to October 15; Grandia HD Collection update planned for November 12,1
pSA: uPlay+ trial isn't a free MONTH! On 1st October you'll be charged no matter when you signed up,1
Racial Stereotyping May Be Why Video Games Are Blamed For School Shootings,1
"My adventure game ENCODYA just entered its last week of crowd funding! Here the trailer. If you like it, please consider a contribute (Kickstarter link in the comments)",1
As they were discontinued I wrote a little guide on setting up Steam Link on a Raspberry Pi! Let me know what you think! :),1
AGONIA - Indie RPG - Newly opened - Free &amp; no microtransaction - Browser - Unique universe,1
World Of Warcraft Battle For Azeroth - Who Are The Naga ?,1
"[Giveaway] I have steam keys for Hiveswap act 1, deep sky derelicts, and Cat Quest.",1
Our indie studio wanted to board massive capital ships in 1st person and fly spaceships in 3rd person...,1
Best Melee Button For FPS.,1
Endless Space collection is free on Humble for a limited time,1
Borderland 3 performance issue : Turns out DX12 was the solution (at least for me),1
System Shock 3 Pre Alpha Gameplay Teaser (OtherSide Entertainment),1
Any game out there like MTG: Shandalar?,1
What happen to RetroArch release on steam?,1
"Shadow Warrior 2 and Bloodstained Ritual of the night, are now available on the xbox game pass for pc",1
List of HDR supporting games?,1
Is it worth investing in a newer SSD for loading times?,1
The Atmospheric Worlds Of Infinity Battlescape,1
"(UK) Ban children from gambling in games, MPs say",1
Loot boxes - The beginning of the End.,1
"Gaming injuries ‘same as basketball players’, says doctor",1
CoD Minimap,1
Giveaway of four Steam keys,1
Atelier Dusk Trilogy is coming to PC (PS4 &amp; Switch as well),1
War of Rights - Field Report 43: Artillery Progress Update,1
I left my job at Riot Games to make my dream online game inspired by games like Mafia/Werewolf and Trouble in Terrorist Town. After 14 months we are finally entering our closed alpha 👽👽,1
Mutazione has released on Steam and GOG,1
"This is the 13th major update for our Early Access game Fort Triumph, dubbed a “fantasy X-COM”. Listening to the community works like a charm for us!",1
"Let's talk about the Nvidia Sharpening filter, and you thoughts and settings on it.",1
The Escapists 2 and 5 other games added to Origin Access Basic,1
Larian's Great Valve Heist,1
GreedFall - Review Thread,1
The Long Dark - Episode 3: Crossroads Elegy (Releasing October 22nd),1
The Black Masses - Free Demo Teaser(Full Trailer Debuts Sept 26th),1
Arkham Knight with/without Denovo in game benchmarks,1
ArcheAge Shadows Revealed - Enhanced Graphics 2019,1
Deadly Premonition 2 is apparently not coming to PC,1
Anyone else losing interest in gaming?,1
Voting is open for the Golden Joystick Awards 2019,1
"What's a game you keep going back to, even if just for little dips here and there?",1
[DigitalFoundry] Control DLSS Analysis: How Nvidia's AI Scaling Tech Has Improved &amp; Evolved!,1
"Tom Clancy’s Ghost Recon® Breakpoint – Year 1 Intel and Purchasable Content (Crafting materials ""time savers"" purchasable with real money)",1
"Gears 5 is ""Xbox Game Studios’ best-ever debut on Steam.""",1
"What Are You Playing Thread - September 17, 2019",1
"New releases, led by Borderlands 3, shake up EMEAA charts.",1
Today in Dwarf Fortress... - A Lost Outpost in The Far North.,1
Devil's Hunt - Savior Trailer,1
"When fullscreen, shadows blur.",1
Spiderweb's Queen's Wish: The Conqueror released,1
Batman Arkham Knight DLC ‘now free via Epic Games store too’,1
A Total War Saga: TROY - Announce Trailer,1
Atelier Ryza TGS 2019 Story Trailer,1
Forced regional language when buying games,1
"Would a ""Total War/Simcity"" Collaboration be a Good Idea?",1
"WoW: Patch 8.2.5 goes live on September 24 (US)/September 25 (EU). It will conclude the BFA War Campaign, add new Goblin and Worgen models and more!",1
Cyberpunk 2077 — Official E3 2019 Cinematic Trailer | Behind the Scenes,1
42 Minutes New Gameplay – The Outer Worlds,1
Greedfall has being out for a week does everyone think off it?,1
"PSA: Modern Warfare BETA: Here is a simple config.cfg change that will remove the horrible ""bugged"" blur.",1
How Online Tech has Changed Shopping for the Better (discusses the benefits of sites like G2A),1
"Intel's Gaming Access Newsletter sent a code to people subscribed that can be redeemed for a free game of their choice. Out of the few ""games"" they offer, one is a free mmo, the other one is an mmo that shut down, and another is an education software.",1
Rockstar Has Its Own PC Games Launcher Now,1
Max Pears says you can't romance Keanu Reeves in Cyberpunk 2077,1
Killer Queen Black comes to Steam in October,1
Obsidian Entertainment just opened up 12 new positions. The studio - as already reported before - now lists over 200 employees.,1
"""Sang-Froid - Tales of Werewolves"" is still free on Steam and GOG",1
Criminals work with www.cdkever.com,1
Are you ready for just one more new PC launcher? From Wargaming.net,1
VietDoom Dev Diary 1,1
Typing RPG Backspace Bouken has a new Steam demo,1
"Ubisoft Will Not Return to Creating Shorter Games, Says CEO",1
"Nioh 2 launches in early 2020, TGS 2019 trailer Released.",1
Is EA working on a Lord of the Rings game?,1
Why is Integer Scaling a premium feature avalaible on more expensive components ?,1
[EpicGamesStore] The Batman Arkham Collection is DRM free after installing.,1
The Last Roman Village - 50% OFF,1
The incoming Steam game library page is a wrapper,1
What Is Variable Rate Shading? A Basic Definition of Nvidia VRS,1
Whats been the saddest detail you've noticed in a game?,1
PSA: Call of Duty : Modern Warfare is a DX12 only game ; Windows 10 required to play.,1
How do I keep mouse sensitivity similar in each game?,1
Shenmue 3 TGS Mood Video - Spirit Of The Land - CERO,1
Empyrion galactic survival,1
Ni no Kuni: Wrath of the White Witch Remastered - Launch Trailer,1
Only 24 titles on Xbox Gamepass for PC?,1
"Suggest-A-Game Weekend Thread - September 21, 2019",1
Blasphemous is out on GoG,1
"This Land Is My Land, anyone play it yet?",1
Why are so many games still with dx11 and not dx12 (and why is Vulkan not that popular?),1
Fallout 76 players aren't impressed with the new $7 fridge,1
ONE PIECE Pirate Warriors 4 - Tokyo Game Show Trailer,1
"For the past 4.5 years, I've been developing an Area 51 themed puzzle game. Today, I'm releasing a free unplanned demo ahead of the closed beta release.",1
"As you get older, do you find yourself only playing the same games?",1
The world’s most freakishly realistic text-generating A.I. just got gamified,1
PC gaming in China: 312 million players generating $15.2 billion in revenue in 2018,1
Does anyone know if the free Lego Batman 3 version on Epic Games include the dlcs?,1
New SilentPatch releases with support for Rockstar Games Launcher version of GTA: San Andreas,1
GOG Galaxy 2.0 Atlas Update overview,1
"Check out Crying Suns on GOG. An awesome successor to FTL! Just released today, and there is a demo available.",1
"When putting your own new pc together, is there anything worse than having to wire LEDs for the chassis? I cringe every time.",1
Indivisible Animated Opening by Studio TRIGGER and Titmouse (FULL VERSION),1
"So Rockstar trojan horsed their new launcher into the Steam version of GTA V, and you can no longer play while in offline mode.",1
The surge 2 - motion capture,1
Why IGI didn't continue its game series?,1
Warner Bros and Funcom have removed Denuvo from Batman: Arkham Knight and Conan Unconquered,1
Every game should copy Death Stranding’s “Very Easy Mode”,1
Risk of Rain 2 Skills 2.0’ Content Update,1
"We're the team behind Clone Hero, a plastic instrument-based rhythm game. AMA!",1
Epic Refund Stinginess,1
Rugby 20 Trailer,1
Borderlands 3's Launch is A Huge Success Despite Launching On the Epic Games Store,1
Dragon Age Writer Opens Game Studio for New IP,1
Wasteland 3 with MS help allows high production values &amp; lots of content (50+ hours)- Dozens of different endings,1
"3 failed prototypes and 4 years later, my spare time game is finally Coming Soon on Steam and attempting a Kickstarter",1
Currently playing modern warfare beta and just wondering does it make sense to lower graphics settings to get better FPS ?,1
Why isn't ASDF used instead of WASD?,1
"Rockstar says Grand Theft Auto 5's offline mode was disabled by a bug, not the launcher",1
God of War Ascension | PC Performance Test,1
Age of Wonders: Planetfall had the best launch sales in series history,1
Gears 5 Devs refused to compromise Gears 5 Framerate as it they did with Gears of War 4.,1
"'Minecraft' has been quietly dominating for over 10 years, and now has 112 million players every month",1
The Surge 2 has released on Steam,1
Trine 4: The Nightmare Prince - Story Trailer | Coming Oct 8,1
Wrist braces for gaming,1
Yuji Naka (former Team Sonic head) working on an Original Action Game at Square Enix,1
Suspect arrested in DDoS attacks that hit WoW servers,1
A better steam layout I quickly made. I hated that blurred image.,1
More evidence of impending RDR2 PC Release.,1
"ACE COMBAT 7: SKIES UNKNOWN Season Pass: SP Missions Trailer | PS4, X1, PC",1
Sonic Smackdown is a fan Sonic fighting game that is heavily inspired by Marvel vs Capcom 3,1
Session: Gameplay Raw Cut 4,1
You cannot start a party through the Xbox game bar but can join one,1
Kine (EGS exclusive) developer says that 'Valve wants developers that are releasing on other storefronts to have a Steam page',1
If you use GeForce Experience and have random games crashing that worked fine before...,1
Wolfenstein II: The New Colossus: some objects update at a lower rate in cutscenes,1
Just A Reminder That Forbes Gave NBA 2K20 A 9/10.,1
Is it possible to buy a game via USB drive?,1
"Forgetful Dictator, a strategy game that teaches geography is coming out this week. I am very proud of this silly game I made.",1
Daybreak Games is Hosting a Preview Event Tomorrow for PlanetSide Arena. Giving Players on Twitter a Chance to Get an Invite.,1
Epic Games store and Launcher: How to handle Cloud Save conflicts (Official FAQ),1
Nioh 2 TGS Trailer,1
Keypad / HID Gaming controller conflict. Request for assistance - Actual USD incentive for solution.,1
Project Resistance Is Getting Downvoted on Youtube,1
Steam Top Releases of August 2019,1
Project Resistance Gameplay Overview,1
Are games worth panting on pc if I’ve played them on Xbox?,1
Destiny 2 - Shadowkeep Roadmap,1
Borderlands 3 Megathread - pt. 2,1
Conan Exiles and Unconquered are having a free weekend on Steam,1
Warframe developer addresses recent review bombing from the Warframe community - VideoGamer.com,1
BETWEEN REALMS Gameplay Demo 2.0,1
"Apple Arcade exclusive means not on Android, consoles and PC are fair game",1
What is Deathgarden Bloodharvest?,1
"Greedfall Review ""Buy, Wait for Sale, Rent, Never Touch?""",1
Cube World Steam Beta now playable for Alpha backers,1
"Trump lifts tariffs on some PC parts, including graphics cards",1
AIO for RX5700XT?,1
Remnant: From the Ashes - Leto's Lab Trailer (Free Update Available Now),1
Planet Zoo: Beta Gameplay Trailer,1
"How many of you are playing ""Russian Style"" (keyboard on the lap instead of the desk."" If you do, why, and for how long? And how many of you doing it are not even playing Quake?",1
Civilization VI is getting a Battle Royale game mode (trailer),1
Paladins - Cross-Play Expands to PlayStation 4!,1
Cube World Release Trailer,1
NBA 2K20 is plagued with issues and taking a hammering on Steam,1
Anyone subscribed to uplay+? Why is it worth it or not?,1
Discord bullish about its platform after dropping free games from Nitro subscription service,1
Looks like Modern Warfare Beta players already have uncovered the planned loot box system [...],1
Epic takes down their roadmap for Epic Online Services,1
Can someone explain why is everyone praising Gears 5 graphics so much?,1
Tech Youtuber UFD Tech’s son has a rare genetic disorder known as syngap-1 and because of this his son experiences hundreds of seizures a day. Show him some love and support!,1
NEW Conan Unconquered update - Bêlit's Fury,1
Will static electricity affect my pc when its placed on carpet during the winter?,1
"I absolutely hate when the fov_viewmodel (the arms, and the gun) don't scale with the FOV value in FPS game.",1
Is it worth getting the Xbox game pass for PC?,1
Receiver - 2019 Update - Wolfire Games,1
Valve could kill Epic Games at any time...,1
Astellia MMORPG - Headstart begins today. Official launch happens next week on 27th of September,1
Switching from Console to PC,1
Bioware's Former Lead Writer Is Starting An Australian Studio,1
Rune II Release Date Announced for the Epic Games Store: November 2019,1
"Help make a nonviolent tag for steam, follow up post",1
Whats the best FPS game to learn keyboard &amp; mouse on?,1
Ion Fury 1.02 Update is out!,1
WWZ getting crossplay!,1
what is the most recent high-end benchmark game similar to the original crysis?,1
Borderlands 3's Review Situation Sure Is Strange,1
"Afterparty, the next game from Oxenfree's developers, will be out in October",1
New flightsimulator preview and Insider build signup,1
"Is Epic Games Store Exclusivity ""THAT"" bad?",1
"Microsoft has fixed the Cortana High CPU usage bug, addresses new security vulnerabilities",1
"Rainbow Six Siege, I give up on you.",1
Would you consider video games to be art?,1
Corsair H115i Platinum in a Lian Li PC-011 Dynamic?,1
What are some must haves in an indie PC game?,1
League of Legends is still the Biggest PC Game ― Riot Games Announced.,1
"Might and Delight (Shelter, PID) new game Book of Travels - Announcement Trailer",1
New features in the ANNO 1800 Botanica DLC.,1
"Manifold Garden dev talks about the community response after announcing that his game is now an Epic Store exclusive: ""It's been an interesting experience. Overall the response has been incredibly positive and we've received a lot of support""",1
Is there a graph of hand sizes or something so I can see if I should buy larger mice or not?,1
GOG Release: Call of Juarez: Bound in Blood and Gunslinger,1
"What if Minecraft or a Gmod type sandbox ( in Quake engine , unreal engine or Gold src) was released in 1990s ?",1
ISFE: French Ruling on Copyright flies in face of established EU law,1
RetroArch v1.7.8 (v4) released,1
Why do people act like “sweaty players” are a negative to a game?,1
Cyberpunk 2077 Japanese Trailer,1
"Inside The Ghosting, Racism, And Exploitation At Game Publisher Nicalis - Jason Schreier",1
Forced TAA on AAA games,1
Epic / Psyonix hiked up Rocket League price on Steam in many countries that used to have regional pricing,1
Steam needs a non-violent tag,1
Epic Games Paid 9.49M Euros For Control's Exclusivity According To Digital Bros,1
"Software for ""enhancing"" in-game graphics?",1
DRAGON BALL Z: KAKAROT Steam Page is Up,1
Gaming Gloves,1
PlanetSide Arena: Free to Play Launch Gameplay Trailer,1
Call of Duty: Modern Warfare 2019 PC Open Beta thread.,1
Digimon Story Cyber Sleuth: Complete Edition - Raising/Training Trailer,1
Red Dead Redemption 2 PC just got classified by the Australian Classification!,1
&lt;giveaway&gt; A game of your choice for $30,1
who uses Anti Aliasing?,1
Stranded Sails - Explorers of the Cursed Islands Gameplay Trailer,1
Nvidia's bringing HDMI 2.1 VRR support to its RTX 20 Series GPUs - G-Sync is coming to TVs,1
Will Diablo III ever go past 60 frames?,1
We are two brothers that are passionate about games and decided to make one. It's taken 2 years so far and we are launching our game as early access on Steam later this year. Here is our trailer.,1
Is new cod mw a suitable replacement for battlefield bc2 and squad?,1
Here's an idea. Preorder a game and get the game plus all extra content for the same price as buying the game on the day,1
Jurassic Dream Lets You Peacefully Explore A CryEngine Jurassic Park,1
steam library broken after update,1
What's the lowest resolution you've had to played a game on just to have it at a playable framerate?,1
Daymare: 1998 is now available on Steam,1
LGBTQ+ charity to raise donations through Pride computer game,1
"Everspace 2 devs talk about Epic's and Valve's storefronts: ""Without Epic, Rockfish and Everspace wouldn't exist, but it's the same with Steam""; ""Valve has the best platform, by far, to roll out a game as an independent developer""",1
PlanetSide Arena: Launch Gameplay Trailer,1
Author of the Red Dead Redemption Enhancement Project released an update video on a situation,1
Fairy Tale TGS 2019 Character Trailer,1
Hot Lava [Official Launch Trailer],1
Novel/story that you'd like to be into a game?,1
Sekiro: Sadows Die Twice - GTX 1050 Ti (Max Settings) Benchmark,1
"Mcindus, Final Fantasy 8 modder AMA on r/finalfantasy",1
PSA: Reddit is having issues.,1
Can Rare Replay come to PC?,1
Boycotting (timed) Epic exclusives hurts you the most,1
"If you're trying to resist buying Borderlands 3, check out Remnant: From the Ashes instead. It's a great new loot shooter that's only $40 on Steam.",1
People who worked on Batman: Arkham Origins are teasing a new game,1
Best Agenda 2030 - Latest trailer! Me and my wife have been working on the game for two years. Leaving Steam early access in a few months.,1
A Plague Tale : Innocence Free Trial is Available Now,1
Punch Planet - Cinematic Trailer,1
Bloom: Memories - Trailer (7+ YEARS in the making!),1
'Borderlands 3' PC Sales Reveal An Important Truth About The Epic Games Store,1
Best game launcher or service for a library computer lab,1
"DF Direct! Modern Games Look Amazing On CRT Monitors... Yes, Better than LCD!",1
"""Wabbajack""lets you install hundreds of Fallout 4 or Skyrim mods in minutes",1
Steam's top wishlisted games,1
AMD’s Ryzen 9 3950X launch delayed by two months to meet “strong demand”,1
DAYMARE: 1998 - Release Trailer (Raven's demons),1
Trials of Mana TGS 2019 Gameplay,1
Terminator Resistance - Announcement Trailer,1
"Instead of fixing numerous game breaking bugs and performance issues, Borderlands 3 developers Nerf legendary drop rates and farming spots in first patch.",1
Does the Epic Game Launcher have a geoblocker enabled?,1
Blasphemous has just released on steam,1
Hack the '80s internet in free hacking adventure Wardialler | PCGamer,1
Any modern games which let you use your own music tracks in game?,1
Is it true that Borderlands 3 is using a keylogger ?,1
"The Game Awards 2019 Date Announced by Geoff Keighley: Thursday, December 12, 2019.",1
We Happy Few - Lightbearer DLC is available and pretty funny imo...,1
Digimon Story Cyber Sleuth: Complete Edition - Battle Trailer,1
DRAGON BALL Z: KAKAROT – Power-UP for Launch on 1.17.19,1
"Tech Support and Basic Questions Thread - September 19, 2019",1
Good news! New ANNO 1800 DLC! Bad news! Your 40 hour saves are being held ransom due to a bug Ubisoft created 2 weeks ago!,1
Valve doesn’t comment on Epic Games Store exclusives because it acts as a “lightning rod” for harassers,1
I refunded Borderlands 3 and uninstalled it from the Epic Games Store but found its install directory and its executable is still there and I can unfortunately continue to play Borderlands 3 even though it's gone.,1
Insurgency: Sandstorm Developers Discuss Canceled Game Set in Nicaragua,1
Don't expect many Borderlands 3 reviews before launch - only US sites got code,1
NBA2K20 is currently the 2nd worst rated game on Steam only behind FlatOut 3,1
Super Robot Wars V for PC is region-locked to Japan and Southeast Asia - Gematsu,1
Dino Crisis FAN Remake - Trailer,1
Valve's VR game Recap - Kerry Davis at Digipen,1
GoG Customer Policy,1
AMD hosted a VLAN over the weekend and they gave the grand prize to an AMD Red Team Plus member...,1
Little Misfortune now released on Steam,1
Rebel Cops - Release Trailer,1
"I believe that the issue with ""too many launchers"" can be solved if all storefronts were to be like GOG.",1
Mutazione Launching September 19th,1
How does AC:Odysseus rank among my fellow pc gamers? Is it a legendary rpg?,1
Dragon Ball Z KAKAROT - Open World Gameplay (Vegeta),1
Report: Modern Warfare PC Beta Files contains many references to Battle Royale | Charlie INTEL,1
Giant Bomb claims they were denied a Borderlands 3 review copy due to 'dubious E3 coverage'.,1
Mod Introduction and Feedback Thread,1
Beyond Development Update 2 - No Man's Sky,1
